Name,Wiki URL,Image URL,Description
Archana Puran Singh,https://en.wikipedia.org/wiki/Archana_Puran_Singh,https://upload.wikimedia.org/wikipedia/commons/thumb/b/bd/Archana_puran_singh_1.jpg/220px-Archana_puran_singh_1.jpg,"Archana Puran Singh (born 26 September 1962) is an Indian television presenter and film actress. She is known for comedy roles in Bollywood movies and as a judge on comedy shows like Sony TV India's The Kapil Sharma Show. She has been judging the television reality comedy show, Comedy Circus, since 2006 and is the only judge to have appeared in all episodes."
Aparajita Mohanty,https://en.wikipedia.org/wiki/Aparajita_Mohanty,https://upload.wikimedia.org/wikipedia/commons/thumb/a/a6/India_film_clapperboard_%28variant%29.svg/30px-India_film_clapperboard_%28variant%29.svg.png,"Aparajita Mohanty is an Oriya movie actress based in Bhubaneswar, Odisha, India. She is the wife of Odia actor Uttam Mohanty and mother of actor Babushan."
Anurita Jha,https://en.wikipedia.org/wiki/Anurita_Jha,https://upload.wikimedia.org/wikipedia/commons/thumb/5/53/Anurita_Jha_at_3rd_Expandables_Awards_2019.jpg/220px-Anurita_Jha_at_3rd_Expandables_Awards_2019.jpg,"Anurita Jha (born 17 September 1986) is an Indian actress and model. She hails from Madhubani Bihar and was groomed and studied at Patna and Delhi (correspondence study). She has taken part in fashion weeks in Delhi as well as Mumbai. She made her acting debut in Bollywood with Anurag Kashyap's Gangs of Wasseypur - Part 1 and appeared in its sequel Gangs of Wasseypur - Part 2 too. She took part in the Ford Supermodel competition in 2005, and won the ""Channel V Get Gorgeous 2006"" competition in 2006."
Anu Mehta,https://en.wikipedia.org/wiki/Anuradha_Mehta,https://upload.wikimedia.org/wikipedia/commons/thumb/4/4b/Anumehta.jpg/220px-Anumehta.jpg,"Anuradha Mehta is an Indian actress and former model who appeared in Telugu and Kannada films She made her debut with the Telugu movie Arya, by which she gained popularity and applause by her performance. She also appeared in some Kannada films. She disappeared later from Telugu and Kannada films."
Anupama Parameswaran,https://en.wikipedia.org/wiki/Anupama_Parameswaran,https://upload.wikimedia.org/wikipedia/commons/thumb/e/eb/Anupama_Parameswaran.jpg/220px-Anupama_Parameswaran.jpg,"Anupama Parameswaran is an Indian film actress who predominantly appears in Telugu, Malayalam, Tamil, Kannada films.She is best known for her debut role as Mary George in the Malayalam film Premam (2015). Later she appeared in Telugu films such as Sathamanam Bhavati (2017) and  Vunnadhi Okate Zindagi (2017). Her Kannada debut was Natasarvabhouma with Puneeth Rajkumar."
Anusha Dandekar,https://en.wikipedia.org/wiki/Anusha_Dandekar,https://upload.wikimedia.org/wikipedia/commons/thumb/4/42/Anousha_Dandekar_unveils_MTV_The_ONE_%2813%29.jpg/220px-Anousha_Dandekar_unveils_MTV_The_ONE_%2813%29.jpg,"Anusha Dandekar (born 9 January 1982) is an Indian-Australian MTV VJ, actress and singer, who is best known as a VJ and a host who has hosted several shows."
Anushka Sharma,https://en.wikipedia.org/wiki/Anushka_Sharma,https://upload.wikimedia.org/wikipedia/commons/thumb/e/e6/Anushka_Sharma_promoting_Zero.jpg/220px-Anushka_Sharma_promoting_Zero.jpg,"Anushka Sharma (pronounced ; born 1 May 1988) is an Indian actress and film producer who works in Hindi films. One of the most popular and highest-paid actresses in India, she has received several awards, including a Filmfare Award. She has appeared in Forbes India's Celebrity 100 since 2012 and was featured by Forbes Asia in their 30 Under 30 list of 2018."
Anupama Verma,https://en.wikipedia.org/wiki/Anupama_Verma,https://upload.wikimedia.org/wikipedia/commons/thumb/0/08/Anupama_Verma.JPG/220px-Anupama_Verma.JPG,"Anupama Verma (born 1972) is a model, actress, and television personality from Lucknow. She was a contestant in the reality show Bigg Boss in 2006. She was the main lead in the song Biddu Boom boom, sung by late Nazia Hassan. She has also acted in many movies and TV commercials."
Ansiba Hassan,https://en.wikipedia.org/wiki/Ansiba_Hassan,,"Ansiba Hassan is a Malayalam actress , television anchor and dancer. Her first role was in the 2013 Tamil film Paranjothi, directed by Gobu Balaji. Her popularity grew as a result of her appearance in Jeethu Joseph's 2013 hit Malayalam movie Drishyamcitation needed] where she played the part of Anju, the daughter of an ordinary cable TV operator."
Ann Augustine,https://en.wikipedia.org/wiki/Ann_Augustine,https://upload.wikimedia.org/wikipedia/commons/thumb/a/a6/India_film_clapperboard_%28variant%29.svg/29px-India_film_clapperboard_%28variant%29.svg.png,Ann Augustine (born Anate Augustine 30 July 1989) is an Indian film actress who appears in Malayalam films. She is the daughter of Malayalam actor Augustine. She made her debut in Lal Jose's Elsamma Enna Aankutty (2010).
Anu Sithara,https://en.wikipedia.org/wiki/Anu_Sithara,,Anu Sithara is an Indian film actress who appears in Malayalam cinema.
Anu Aggarwal,https://en.wikipedia.org/wiki/Anu_Agarwal,https://upload.wikimedia.org/wikipedia/commons/4/41/Anu_Aggarwal_snapped_at_the_special_screening_of_Begum_Jaan_%28cropped%29.jpg,"Anita Aggarwal also known as Anu Aggarwal (born 11 January 1969) is a former Indian model and actress. She is best known for her works in Aashiqui, The Cloud Door and Thiruda Thiruda."
Anu Prabhakar,https://en.wikipedia.org/wiki/Anu_Prabhakar,https://upload.wikimedia.org/wikipedia/commons/thumb/e/e0/Anu_Prabhakar_-_TeachAIDS_Interview.png/220px-Anu_Prabhakar_-_TeachAIDS_Interview.png,"Anu Prabhakar (born 9 November 1980), also known by her married name Anu Prabhakar Mukherjee, is an Indian film actress, who predominantly appears in Kannada films and is from Mangalore."
Anushka Shetty,https://en.wikipedia.org/wiki/Anushka_Shetty,https://upload.wikimedia.org/wikipedia/commons/thumb/c/c5/Anushka_Shetty2.jpg/220px-Anushka_Shetty2.jpg,"Sweety Shetty (born 7 November 1981), known by her stage name Anushka Shetty, is an Indian actress and model who predominantly works in the Telugu and Tamil film industries. She has received several accolades, including three CineMAA Awards, a Nandi Award, TN State Film Awards and three Filmfare Awards from eight nominations. Anushka is one of the highest paid actresses of India and is popularly referred as Lady Superstar of south Indian cinema."
Anjana Sukhani,https://en.wikipedia.org/wiki/Anjana_Sukhani,https://upload.wikimedia.org/wikipedia/commons/thumb/0/02/Anjana_Sukhani_at_59th_Filmfare_Awards.jpg/220px-Anjana_Sukhani_at_59th_Filmfare_Awards.jpg,"Anjana Sukhani (born 10 December 1978) is an Indian  film actress and model, who predominantly appears in Bollywood films."
Anjali Sudhakar,https://en.wikipedia.org/wiki/Anjali_Sudhakar,https://upload.wikimedia.org/wikipedia/commons/thumb/e/ee/Anjali_Sudhakar_DXB.jpg/220px-Anjali_Sudhakar_DXB.jpg,"Anjali (Kannada: ಅಂಜಲಿ) (born 22 May 1972) is an Indian Sandalwood movie and television actress who appeared in Kannada cinema. Her original name was Shantha, before director Kashinath named her as Anjali."
Antara Mali,https://en.wikipedia.org/wiki/Antara_Mali,https://upload.wikimedia.org/wikipedia/commons/thumb/a/a6/India_film_clapperboard_%28variant%29.svg/30px-India_film_clapperboard_%28variant%29.svg.png,"Antara Mali (born 20 October 1975) is an Indian actress, director, and screenwriter, who predominantly works in Bollywood films, and has also acted in a Malayalam and Telugu film."
Anju Mahendru,https://en.wikipedia.org/wiki/Anju_Mahendru,https://upload.wikimedia.org/wikipedia/commons/thumb/1/1a/Anju_Mahendru.jpg/220px-Anju_Mahendru.jpg,Anju Mahendru (born 11 January 1946) is an Indian actress. She is best known as Reeva in Kahiin To Hoga and Kamini Gupta in Kasautii Zindagii Kay.
Anjana Bhowmick,https://en.wikipedia.org/wiki/Anjana_Bhowmick,,"Anjana Bhowmik was an actress of  Bengali cinema from the 1960s until the 1980s. She was born on 30 December 1944 in Cooch Behar. Her real name is Arati Bhowmik and nickname Babli. Her father was Bibhuti Bhusan Bhowmik. She spent her school days in Cooch Behar. She passed the Higher Secondary Exam of West Bengal Board from Suniti Academy of Cooch Behar in 1961. After that she also studied in Sarojini Naidu College, an undergraduate college, then affiliated with the University of Calcutta."
Anjala Zaveri,https://en.wikipedia.org/wiki/Anjala_Zhaveri,https://upload.wikimedia.org/wikipedia/commons/thumb/4/4a/AnjalaZaveri.jpg/220px-AnjalaZaveri.jpg,"Anjala Zaveri is an Indian British actress. She appeared in Telugu, Hindi, Tamil, Malayalam and Kannada films."
Ankita Lokhande,https://en.wikipedia.org/wiki/Ankita_Lokhande,https://upload.wikimedia.org/wikipedia/commons/thumb/5/53/Ankita_Lokhande.JPG/220px-Ankita_Lokhande.JPG,"Ankita Lokhande is an Indian film and television actress known for portraying Archana in Zee TV's Pavitra Rishta as well as participating on Colors TV's reality dance series Jhalak Dikhhla Jaa 4. In January 2019, her debut film, the period war drama Manikarnika: The Queen of Jhansi, in which she played warrior Jhalkaribai, was released and performed moderately well at the box office. Lokhande is one of Indian television's highest-paid actresses. She appeared in the 2020 action thriller film Baaghi 3."
Anita Raj,https://en.wikipedia.org/wiki/Anita_Raj,https://upload.wikimedia.org/wikipedia/commons/thumb/9/98/AnitaRaj.jpg/220px-AnitaRaj.jpg,"Anita Raj is an Indian actress and a daughter of Jagdish Raj, whose notable roles include Prem Geet (1981), Kusum in Zara Si Zindagi (1983), Anita in Zameen Aasman (1984) and Shobha in Masterji (1985)."
Anjali Devi,https://en.wikipedia.org/wiki/Anjali_Devi,https://upload.wikimedia.org/wikipedia/commons/thumb/4/44/Anjali_Devi_in_Mangaiyarkarasi_1949.jpg/220px-Anjali_Devi_in_Mangaiyarkarasi_1949.jpg,"Anjali Devi (pronunciation (help·info)hk; 24 August 1927 – 13 January 2014) was an Indian actress, model and producer in Telugu and Tamil films. She was well known for her role as the Devi Sita in Lava Kusa as well as for the titular roles in movies like Suvarna Sundari and Anarkali."
Andrea Jeremiah,https://en.wikipedia.org/wiki/Andrea_Jeremiah,https://upload.wikimedia.org/wikipedia/commons/thumb/5/5d/Andrea_Jeremiah.jpg/220px-Andrea_Jeremiah.jpg,"Andrea Jeremiah is an Indian actress, playback singer and musician. She works predominantly in the Tamil and Malayalam film industries. She also appeared in Telugu Films. She began her career as a playback singer, and has subsequently appeared in films."
Anaswara Kumar,https://en.wikipedia.org/wiki/Anaswara_Kumar,https://upload.wikimedia.org/wikipedia/commons/thumb/b/be/Anaswara_at_HCL_2013_Year_End_Celebrations%2C_Chennai%2C_12-19-13_%283%29_%28cropped%29.jpg/220px-Anaswara_at_HCL_2013_Year_End_Celebrations%2C_Chennai%2C_12-19-13_%283%29_%28cropped%29.jpg,"Anaswara Kumar is an Indian film actress, who works in the Tamil film industry. She started her career with Arivazhaghan's sports thriller Vallinam (2014), though the romantic comedy Ego (2013) released first. She made her breakthrough portraying Mohini in the black comedy film Yaamirukka Bayamey, which became a commercial success."
Andria D'Souza,https://en.wikipedia.org/wiki/Andria_D%27Souza,https://upload.wikimedia.org/wikipedia/commons/thumb/a/a6/India_film_clapperboard_%28variant%29.svg/30px-India_film_clapperboard_%28variant%29.svg.png,"Andria D'Souza aka Ria D'Souza aged 44 is an Indian born in Dubai. She is a TV presenter Zee Connect, TV Anchor on  Zee TV, Dubai and actor based in India, mainly active in Hindi and Malayalam films Six X."
Anita Guha,https://en.wikipedia.org/wiki/Anita_Guha,https://upload.wikimedia.org/wikipedia/en/d/d8/Anita_guha.jpg,"Anita Guha was an Indian Bengali actress who usually played mythological characters in films. She became known for playing the title role in Jai Santoshi Maa (1975). Previously, she had played Sita in other mythological films; Sampoorna Ramayana (1961), Shree Ram Bharat Milap (1965) and Tulsi Vivah (1971). Besides this, she also played notable roles in films such as Goonj Uthi Shehnai (1959), Purnima (1965), Pyar Ki Rahen (1959), Gateway of India (1957), Dekh Kabira Roya (1957) and Sanjog (1961)."
Ananya Kasaravalli,https://en.wikipedia.org/wiki/Ananya_Kasaravalli,https://upload.wikimedia.org/wikipedia/commons/thumb/a/a6/India_film_clapperboard_%28variant%29.svg/30px-India_film_clapperboard_%28variant%29.svg.png,"Ananya Kasaravalli is an Indian film actress and director in the Kannada film industry, and a theatre artist in Karnataka, India. Some of the notable films of Ananya Kasaravalli as an actress include Kaada Beladingalu (2007) and Naayi Neralu (2006)."
Ananya (actress),https://en.wikipedia.org/wiki/Ananya_(actress),https://upload.wikimedia.org/wikipedia/commons/thumb/7/78/Ananya.jpg/220px-Ananya.jpg,"Ayilya Nair, better known by her stage name Ananya, is an Indian film actress, who appears in Malayalam, Tamil, Kannada and Telugu films"
Anaika Soti,https://en.wikipedia.org/wiki/Anaika_Soti,https://upload.wikimedia.org/wikipedia/commons/thumb/9/93/Anaika_Soti.jpg/220px-Anaika_Soti.jpg,"Anaika Soti (born 14 January 1991) is an Indian film actress who appears in Tamil, Telugu and Hindi films. After making her debut in Ram Gopal Varma's bilingual Satya 2 (2013), she went on to feature in Vasanthabalan's period drama Kaaviya Thalaivan, for which she was nominated for the Filmfare Award for Best Supporting Actress - Tamil."
Anita Hassanandani,https://en.wikipedia.org/wiki/Anita_Hassanandani_Reddy,https://upload.wikimedia.org/wikipedia/commons/2/26/Anita_Hassanandani_Reddy_snapped_promoting_the_film_Bareilly_Ki_Barfi_%2802%29_%28cropped%29.jpg,Anita Hassanandani (born 14 April 1981) is an Indian actress who has acted in multilingual films and serials. She is best known for portraying Shagun Arora in Star Plus's Yeh Hai Mohabbatein and a female shape-shifting serpent named Vishakha Khanna in Colors TV's Naagin.
Anjali (actress),https://en.wikipedia.org/wiki/Anjali_(actress_born_1986),https://upload.wikimedia.org/wikipedia/en/thumb/f/ff/AnjaliWiki.jpg/200px-AnjaliWiki.jpg,"Anjali is an Indian film actress and model, who predominantly appears in Tamil  and Telugu films. Following a stint in modelling, she was cast in starring roles in two Telugu productions; her début film was the Telugu film Photo, which released in 2006, before bagging a role and gaining attention in the film Kattradhu Thamizh (2007) with Jiiva. In 2010 and 2011, she won the Filmfare Award for Best Actress - Tamil, for her performances in Angaadi Theru and Engaeyum Eppothum respectively, & Tamil Nadu State Film Award For Angadi Theru subsequently becoming recognised as one of the ""finest young actors"" in Tamil cinema, and noted for mostly playing ""performance-oriented roles""."
Amyra Dastur,https://en.wikipedia.org/wiki/Amyra_Dastur,https://upload.wikimedia.org/wikipedia/commons/thumb/3/3d/Amyra_Dastur_snapped_during_photoshoot_%282%29_%28cropped%29.jpg/220px-Amyra_Dastur_snapped_during_photoshoot_%282%29_%28cropped%29.jpg,"Amyra Dastur (born  7 May 1993) is an Indian film actress who has starred in mainly Hindi films, but has also starred in some Tamil and Telugu films.  She made her Bollywood debut with  Issaq, opposite Prateik Babbar. She started her career at the age of 16 as a model in a few commercials including Clean and Clear, Dove (toiletries), Vodafone and Micromax. She starred in Mukesh Bhatt's sci-fiction thriller Mr. X alongside Emraan Hashmi. She had also acted in a Tamil movie, Anegan alongside Dhanush."
Amrita Rao,https://en.wikipedia.org/wiki/Amrita_Rao,https://upload.wikimedia.org/wikipedia/commons/thumb/3/3d/Amrita_Rao_during_Thackeray_interviews_at_Sun_N_Sand_in_Juhu_%2806%29_%28cropped%29.jpg/220px-Amrita_Rao_during_Thackeray_interviews_at_Sun_N_Sand_in_Juhu_%2806%29_%28cropped%29.jpg,"Amrita Rao is an Indian film actress and model. She has appeared as the leading lady in several Hindi films of Bollywood and one movie in Telugu. Rao was born and raised in Mumbai; she made her screen debut in Ab Ke Baras (2002), for which she was nominated for the Filmfare Best Female Debut Award in 2003. One of her most popular roles was in the romance film Vivah (2006)."
Anaswara Rajan,https://en.wikipedia.org/wiki/Anaswara_Rajan,https://upload.wikimedia.org/wikipedia/commons/thumb/a/a6/India_film_clapperboard_%28variant%29.svg/29px-India_film_clapperboard_%28variant%29.svg.png,"Anaswara Rajan (8 September 2002) is an Indian actress who is known for her work in the Malayalam and Tamil film industries. Her first movie was Udaharanam Sujatha(2017). She made her acting debut in the Malayalam short film Globe. Anaswara gained popularity in the commercially successful Malayalam film, Thanneer Mathan Dinangal (2019) and  Adhyarathri (2019). She along with her co-star Mathew Thomas received 22nd Asianet Film Awards 2020 Best Star Pair Award for the role of Keerthy and Jaison in Thanneer Mathan Dinangal (2019)."
Amrita Singh,https://en.wikipedia.org/wiki/Amrita_Singh,https://upload.wikimedia.org/wikipedia/commons/thumb/f/fe/Amrita_Singh_%26_Sara_Ali_Khan_at_Shaadi_By_Marriott_showcase_%2808%29_%28cropped%29.jpg/220px-Amrita_Singh_%26_Sara_Ali_Khan_at_Shaadi_By_Marriott_showcase_%2808%29_%28cropped%29.jpg,"Amrita Singh (born 9 February 1958) is an Indian actress. Through her films like Betaab and Mard, she gained popularity and became a well known and popular actress in the 1980s. She took a break from acting in the early 1990s for a decade and returned to acting in 2002, occasionally playing supporting roles. She also made her debut on television in 2005.  Amrita keeps a low public profile and gives few interviews."
Amrita Prakash,https://en.wikipedia.org/wiki/Amrita_Prakash,https://upload.wikimedia.org/wikipedia/commons/thumb/a/a2/Amrita_Prakash.jpg/220px-Amrita_Prakash.jpg,"Amrita Prakash is an Indian film actress and model. She began her acting career when she was four years old, and has acted in both Bollywood and Malayalam films. She has since, been seen in a myriad of Bollywood Films, TVCs and television reality and fiction shows. She is last seen playing the role of Jasleen in the Colors TV's acclaimed show Shakti - Astitva Ke Ehsaas Ki."
Amruta Khanvilkar,https://en.wikipedia.org/wiki/Amruta_Khanvilkar,,Amruta Khanvilkar Malhotra (born 23 November 1984) is an Indian actress. She was born in Mumbai. She worked in Hindi and Marathi movies. She is popular for her dancing and participating in Fear Factor: Khatron Ke Khiladi 10.
Amy Jackson,https://en.wikipedia.org/wiki/Amy_Jackson,https://upload.wikimedia.org/wikipedia/commons/thumb/1/13/Amy_Jackson_headshot.jpg/220px-Amy_Jackson_headshot.jpg,"Amy Jackson (born 31 January 1992) is an English actress and model best known for her work in Indian films. She began her modelling career at the age of 16, and went on to win the Miss Teen World competition in 2009. Subsequently, director A. L. Vijay cast her as the leading lady of the Tamil language period drama Madrasapattinam (2010). Jackson continues to act in Indian films of all languages, with some of her notable roles including Ekk Deewana Tha (2012), Singh Is Bliing (2015), The Villain (2018) and 2.0 (2018). She is also known for playing the role of Imra Ardeen / Saturn Girl on the third season of The CW's superhero series Supergirl."
Amrita Arora,https://en.wikipedia.org/wiki/Amrita_Arora,https://upload.wikimedia.org/wikipedia/commons/thumb/0/09/Amrita_arora_kallista_spa.jpg/220px-Amrita_arora_kallista_spa.jpg,"Amrita Arora (born 31 January 1978) is an Indian film actress, model, TV Presenter and VJ."
Ambika (actress),https://en.wikipedia.org/wiki/Ambika_(actress),https://upload.wikimedia.org/wikipedia/commons/thumb/4/40/Actress_Ambika_%28cropped%29.JPG/220px-Actress_Ambika_%28cropped%29.JPG,"Ambika is an Indian film and television actress known for her works predominantly in Tamil, Malayalam, Kannada films and serials. She also did a few Telugu and English films. She was one of the top south Indian heroines for a decade from 1978 to 1989. Her younger sister Radha was also an actress. They acted together in a number of south Indian films and during the peak of their careers."
Ameesha Patel,https://en.wikipedia.org/wiki/Ameesha_Patel,https://upload.wikimedia.org/wikipedia/commons/thumb/9/91/The_glamorous_Film_Star_Amisha_Patel_at_the_%E2%80%98India_%E2%80%93_The_Big_Picture_Conference_%E2%80%93_2005%E2%80%99_organized_by_CII_as_part_of_IFFI_events%2C_in_Panaji%2C_Goa_on_November_24%2C_2005.jpg/220px-thumbnail.jpg,Ameesha Patel (pronounced ; born Amisha Amit Patel) is an Indian actress and model who predominantly appears in Bollywood films. She has also appeared in a few Telugu and Tamil films. She has won a Filmfare Award.
Amulya,https://en.wikipedia.org/wiki/Amoolya,,"Amulya (born Moulya on 14 September 1993) is an Indian film actress who appears in Kannada films. She made her debut as a child artist in the early 2000s and appeared in a lead role in 2007 with Cheluvina Chittara. She is best known for her roles in the commercially successful films Chaitrada Chandrama (2008), Naanu Nanna Kanasu (2010) and Shravani Subramanya (2013)."
Ameeta,https://en.wikipedia.org/wiki/Ameeta,,"Ameeta (born Qamar Sultana, 11 April 1940) is an Indian actress. She appeared in Bollywood films such as Tumsa Nahin Dekha, Mere Mehboob, and Goonj Uthi Shehnai."
Amala Paul,https://en.wikipedia.org/wiki/Amala_Paul,https://upload.wikimedia.org/wikipedia/commons/thumb/4/49/Amala_Paul_at_60th_South_Filmfare_Awards_2013.jpg/250px-Amala_Paul_at_60th_South_Filmfare_Awards_2013.jpg,"Amala Paul  (born 26 October 1991) is an Indian film actress who works in the South Indian Film Industry. After appearing in supporting roles in the Malayalam film Neelathamara. Amala became noted after playing the title role in Mynaa, receiving critical acclaim for her work."
Amala Akkineni,https://en.wikipedia.org/wiki/Amala_(actress),https://upload.wikimedia.org/wikipedia/commons/thumb/7/71/Amala_Akkineni_-_TeachAIDS_Interview_%2812617061074%29_%28cropped%29.png/220px-Amala_Akkineni_-_TeachAIDS_Interview_%2812617061074%29_%28cropped%29.png,"Amala Akkineni (née Mukherjee) is an Indian film actress, Bharata Natyam dancer, and an animal welfare activist. She acted in Tamil, Telugu, Malayalam, Kannada and Bollywood films. She has won two Filmfare Awards South One for Malayalam ( Filmfare Award for Best Actress - Malayalam – Ulladakkam – 1991)
and One for Telugu ( Filmfare Award for Best Supporting Actress – Telugu – Life Is Beautiful- 2012)  . Amala is the co-founder of The Blue Cross of Hyderabad, a non-government organisation (NGO) in Hyderabad, India, which works towards the welfare of animals and preservation of animal rights in India."
Aksha Pardasany,https://en.wikipedia.org/wiki/Aksha_Pardasany,,"Aksha Pardasany is an Indian actress. She has acted in Telugu films such as Yuvatha, Ride and Kandireega."
Akshara Gowda,https://en.wikipedia.org/wiki/Akshara_Gowda,,"Akshara Gowda (born Harini Gowda on 24 December 1991 in gowda family in Bangalore, Karnataka) is an Indian film actress who has appeared in Hindi and Tamil films.  Akshara made a special appearance in Thuppakki and played a role in the festival film Chitkabrey - The Shades of Grey. She made her Bollywood debut in Priyadarshan's Rangrezz in 2013. Akshara appeared in Ajith-vishnuvardhan's Arrambam Tamil film."
Akshara Haasan,https://en.wikipedia.org/wiki/Akshara_Haasan,https://upload.wikimedia.org/wikipedia/commons/thumb/c/ce/Akshara_Haasan_gracing_%E2%80%98Filmfare_Glamour_%26_Style_Awards_2016%E2%80%99.jpg/220px-Akshara_Haasan_gracing_%E2%80%98Filmfare_Glamour_%26_Style_Awards_2016%E2%80%99.jpg,"Akshara Haasan  is an Indian film actress who has appeared in Hindi- and Tamil-language films. The daughter of actors Kamal Haasan and Sarika Thakur, and the younger sister of Shruti Haasan, she made her film debut with the comedy drama Shamitabh (2015), and later appeared in Kadaram Kondan (2017)."
Iswarya Menon,https://en.wikipedia.org/wiki/Akshara_Menon,https://upload.wikimedia.org/wikipedia/commons/thumb/5/5a/Iswarya_Menon.jpg/220px-Iswarya_Menon.jpg,"Iswarya Menon (born Aishwarya Menon) is an Indian film actress who acts in Tamil, Kannada and Malayalam films."
Akanksha Juneja,https://en.wikipedia.org/wiki/Akanksha_Juneja,,Akanksha Juneja is an Indian television actress. She has appeared in a number of television serials and also a few films often as a vamp (खलनायिका). She has most recently replaced actress Chahat Khanna in the role of main villain Ayesha in the famous TV series Bade Acche Lagte Hain.
Aishwarya Devan,https://en.wikipedia.org/wiki/Aishwarya_Devan,https://upload.wikimedia.org/wikipedia/commons/9/97/Aishwarya_Devan_graces_the_launch_of_the_new_resto-bar_Angrezi_Patiyaala_%2810%29_%28cropped%29.jpg,"Aishwarya Devan is an Indian film actress and Beauty queen from Kerala who has acted in Malayalam , Tamil and Kannada language films. She was crowned Femina Miss India Maharashtra 2017 and represented Maharashtra state in Femina Miss India 2017. She won various subtitles during the contest and made it to top-6 finalists. She made her Bollywood debut with the film 'Kashi - in Search of Ganga'."
Aishwarya Nag,https://en.wikipedia.org/wiki/Aishwarya_Nag,https://upload.wikimedia.org/wikipedia/commons/thumb/5/58/Aishwarya_Nag.jpg/220px-Aishwarya_Nag.jpg,"Aishwarya Nag is an Indian film actress and a model, who has appeared in South Indian films, primarily in Kannada cinema. After her modelling, she made her acting debut in the film Neene Neene (2008). She rose to fame by acting in the Kannada film Jolly Days (2009) and Kal Manja (2010)."
