Name,Wiki URL,Image URL,Description
Parzaan Dastur,https://en.wikipedia.org/wiki/Parzan_Dastur,https://upload.wikimedia.org/wikipedia/commons/thumb/a/a6/India_film_clapperboard_%28variant%29.svg/30px-India_film_clapperboard_%28variant%29.svg.png,"Parzaan Dastur is an Indian actor and writer. To many Indians, he is best remembered as the cute kid in the Dhara advertisement and the silent Sikh in Kuch Kuch Hota Hai."
Pinchoo Kapoor,https://en.wikipedia.org/wiki/Pinchoo_Kapoor,https://upload.wikimedia.org/wikipedia/commons/thumb/a/a6/India_film_clapperboard_%28variant%29.svg/30px-India_film_clapperboard_%28variant%29.svg.png,"Pinchoo Kapoor was an Indian actor born in Rawalpindi, Punjab, British India in 1929. He acted in many Hindi films during the 1970s and  1980s. His film career lasted from 1969 to 1989. He is best remembered for his role in the films Don, Roti, Avtaar and Khud-Daar."
Parvin Dabas,https://en.wikipedia.org/wiki/Parvin_Dabas,https://upload.wikimedia.org/wikipedia/commons/thumb/c/c1/Parvin_Dabas.jpg/220px-Parvin_Dabas.jpg,"Parvin Dabas (born 12 July 1974) is an Indian actor, director and model, who works predominantly in Hindi and English language films."
Paresh Rawal,https://en.wikipedia.org/wiki/Paresh_Rawal,https://upload.wikimedia.org/wikipedia/commons/thumb/d/d3/Paresh_Rawal_February_2015.jpg/220px-Paresh_Rawal_February_2015.jpg,"Paresh Rawal (born 30 May 1955) is an Indian film actor, comedian and politician known for his works notably in Bollywood. He was a member of parliament in the Lok Sabha of the Indian Parliament representing the Ahmedabad East constituency from 2014 to 2019. He is politically affiliated with the Bharatiya Janata Party. Rawal speaks Hindi, Gujarati, Marathi, Telugu and English fluently. In 1994, he won the National Film Award for Best Supporting Actor for his performances in the films Woh Chokri and Sir. For the latter, he received his first Filmfare Award for Best Comedian. This was followed by Ketan Mehta's Sardar, which saw him playing the lead role of freedom fighter Vallabhbhai Patel, a role that got him national and international acclaim."
Parmeet Sethi,https://en.wikipedia.org/wiki/Parmeet_Sethi,https://upload.wikimedia.org/wikipedia/commons/thumb/2/23/Parmeet_sethi.jpg/220px-Parmeet_sethi.jpg,"Parmeet Sethi is an Indian film actor, director and writer."
Pawan Kalyan,https://en.wikipedia.org/wiki/Pawan_Kalyan,https://upload.wikimedia.org/wikipedia/commons/thumb/6/63/The_noted_Telugu_film_actor_Shri_Pavan_Kalyan_addressing_at_the_closing_ceremony_and_award_function_of_the_18th_International_Children%E2%80%99s_Film_Festival_India%2C_in_Hyderabad_on_November_20%2C_2013_%28cropped%29.jpg/220px-thumbnail.jpg,"Konidela Kalyan Babu, better known by his stage name Pawan Kalyan is an Indian film actor, producer, director, screenwriter, writer, stunt coordinator, playback singer, choreographer and politician. His film works are predominantly in Telugu cinema. He is the youngest brother of popular actor Chiranjeevi. Pawan Kalyan made his acting debut in the 1996 Telugu film Akkada Ammayi Ikkada Abbayi. In 1998, he starred in Tholi Prema, which won the National Film Award for Best Feature Film in Telugu for that year."
Piyush Mishra,https://en.wikipedia.org/wiki/Piyush_Mishra,https://upload.wikimedia.org/wikipedia/commons/thumb/3/37/Piyush_Mishra_HD_Image.jpg/220px-Piyush_Mishra_HD_Image.jpg,"Piyush Mishra (born 13 January 1963) is an Indian film and theatre actor, music director, lyricist, singer and scriptwriter. Mishra grew up in Gwalior, and went to graduate from National School of Drama, Delhi in 1986. Thereafter, he started his career in Hindi theatre in Delhi. Over the next decade, he established himself as a theatre director, actor, lyricist and singer. He moved to Mumbai in 2002, receiving acclaim for his acting in Maqbool (2003) and Gangs of Wasseypur (2012).In 2014 Hindi comedy film The Shaukeens Piyush Mishra acted alongside Anpuam Kher, Annu Kapoor and Lisa Hayden in the lead roles, and Akshay Kumar in a supporting role, Piyush did appear on Kapil Nights the Kapil Sharma Show to promote the film with Anpuam Kher & Annu Kapoor, although the film was a remake of the 1982 film Shaukeen directed by Basu Chatterjee, starring Ashok Kumar, Utpal Dutt, A. K. Hangal, Rati Agnihotri, and Mithun Chakraborty. It was well appreciated by audiences and voted by the public as the best comedy film of 2014."
Pankaj Tripathi,https://en.wikipedia.org/wiki/Pankaj_Tripathi,https://upload.wikimedia.org/wikipedia/commons/thumb/5/50/Pankaj_Tripathi_World_Premiere_Newton_Zoopalast_Berlinale_2017_06.jpg/220px-Pankaj_Tripathi_World_Premiere_Newton_Zoopalast_Berlinale_2017_06.jpg,"Pankaj Tripathi is an Indian actor who appears predominantly in Hindi films. He debuted in 2004 with a minor role in Run and Omkara and has since worked in more than 40 films and 60 television shows. Tripathi's breakthrough came in 2012 for his supporting role in the Gangs of Wasseypur film series. He has since received critical appraisal for multiple films, including Fukrey (2013), Masaan (2015), Nil Battey Sannata (2016), Bareilly Ki Barfi (2017), Newton (2017), Fukrey Returns (2017) and Stree (2018). For Newton, Tripathi earned several awards including a National Film Award – Special Mention."
Omi Vaidya,https://en.wikipedia.org/wiki/Omi_Vaidya,https://upload.wikimedia.org/wikipedia/commons/thumb/1/1e/Omi_Vaidya.JPG/220px-Omi_Vaidya.JPG,"Omi Vaidya (born January 10, 1982) is an American actor, best known for his performance as Chatur Ramalingam or ""The Silencer"" in the 2009 Bollywood film, 3 Idiots. In addition, Vaidya has directed two short films and worked as an editor on others. He has also appeared in a number of television programs and commercials. He is of Indian descent."
Parikshit Sahni,https://en.wikipedia.org/wiki/Parikshit_Sahni,https://upload.wikimedia.org/wikipedia/commons/thumb/f/f0/ParikshitSahni.jpg/220px-ParikshitSahni.jpg,"Parikshit Sahni (born 1 January 1940) is an Indian film and television actor, who is most known for playing the lead in TV series Barrister Vinod, Gul Gulshan Gulfaam (Doordarshan) and Gaatha (Star Plus). He has also appeared in three of Rajkumar Hirani's blockbuster films Lage Raho Munna Bhai, 3 Idiots, and PK."
Prem Kumar (Kannada actor),https://en.wikipedia.org/wiki/Prem_Kumar_(Kannada_actor),,"Prem (Lovely Star ) , known mononymously as Prem, is an Indian film actor who works in Kannada films.  He made his acting debut in 2004 through the film Praana. However, he earned much recognition and won the Filmfare Award for Best Actor for Nenapirali in the year 2005. He is popularly known as Lovely Star in Kannada films."
Pankaj Kapur,https://en.wikipedia.org/wiki/Pankaj_Kapoor,https://upload.wikimedia.org/wikipedia/commons/thumb/a/ac/Pankaj_Kapur.jpg/220px-Pankaj_Kapur.jpg,"Pankaj Kapur (born 29 May 1954) is an Indian theatre, television and film actor. He is the father of actor Shahid Kapoor with his first wife, Neelima Azeem. He has appeared in several television serials and films. His most acclaimed film roles to date have been that of Inspector P.K. in Raakh (1989), Dr. Dipankar Roy in Ek Doctor Ki Maut (1991) and Abba ji, (based on Shakespeare's King Duncan) in Vishal Bhardwaj's adaptation of Macbeth; Maqbool (2004), all three roles which got him National Film Awards."
Om Shivpuri,https://en.wikipedia.org/wiki/Om_Shivpuri,https://upload.wikimedia.org/wikipedia/en/3/38/Om_Shivpuri.jpg,Om Shivpuri (1937 – 15 October 1990) was an Indian theatre actor-director and character actor in Hindi films.
Om Prakash,https://en.wikipedia.org/wiki/Om_Prakash,https://upload.wikimedia.org/wikipedia/commons/thumb/0/0b/Om_Prakash_Actor.jpg/220px-Om_Prakash_Actor.jpg,"Om Prakash Bakshi  (19 December 1919 – 21 February 1998) was an Indian character actor. He was born in Jammu, as Om Prakash Bakshi. He used to play the role of Kamla in the stage play by the famous Dewan Mandir Natak Samaj Jammu. Since his career began in 1942, he was a popular supporting actor from the 1950s until the 1980s. He also produced Jahanaara starring Bharat Bhushan, Shashikala, Prithviraj Kapoor and Mala Sinha in the title role of Jahanaara."
Oduvil Unnikrishnan,https://en.wikipedia.org/wiki/Oduvil_Unnikrishnan,https://upload.wikimedia.org/wikipedia/en/9/9e/Oduvil_Unnikrishnan.jpg,"Oduvil Unnikrishnan (13 February 1943 – 27 May 2006) was an Indian film actor.  He was known for his versatile acting skills, shown in his portrayal of classical ancient aristocratic personalities in Malayalam cinema with his unique provincial linguistic style, expressions and dialect. He was noted as a serious as well as comic actor. He composed music for an album named Parasuram Express (1984) to lyrics written by Bichu Thirumala and an unreleased film named Sarvam Saha directed by Ravi Gupthan."
Omkar Kapoor,https://en.wikipedia.org/wiki/Omkar_Kapoor,https://upload.wikimedia.org/wikipedia/commons/thumb/4/41/Omkar_Kapoor_%2825448614036%29.jpg/220px-Omkar_Kapoor_%2825448614036%29.jpg,"Omkar Kapoor is a Bollywood movie actor. He began his performing career as a child artist and worked in films like Judwaa, Hero No.1 and Judaai. He made his Bollywood debut as a supporting actor with his movie Pyaar Ka Punchnama 2."
Nazir Hussain,https://en.wikipedia.org/wiki/Nazir_Hussain,https://upload.wikimedia.org/wikipedia/commons/thumb/5/5e/Nasir_hussain.jpg/220px-Nasir_hussain.jpg,"Nazir Hussain,  also credited as Nasir Hussain (15 May 1922 – 16 October 1987) was an Indian film actor, director and screenwriter. He was famous as a character actor in Hindi Cinema and acted in almost 500 films. Dev Anand starred in a large proportion of the films he acted in."
Nivin Pauly,https://en.wikipedia.org/wiki/Nivin_Pauly,https://upload.wikimedia.org/wikipedia/commons/thumb/0/01/Nivin_pauly_kannada_wikipedia.jpg/220px-Nivin_pauly_kannada_wikipedia.jpg,"Nivin Pauly (born 11 October 1984) is an Indian actor and producer. Known for his work in Malayalam cinema , he is the recipient of several awards including three Filmfare South and a Kerala State Film Award."
Nithiin,https://en.wikipedia.org/wiki/Nithin,,"Nitin Kumar Reddy, known professionally as Nithiin, is an Indian film actor and producer known for his works predominantly in Telugu cinema. He is the son of noted Tollywood producer and film distributor Sudhakar Reddy. Nithiin made his film debut in the year 2002 with Jayam, for which he received the Filmfare Award for Best Male Debut – South. This film was one of the highest-grossing Telugu films of all time."
N. T. Rama Rao Jr.,https://en.wikipedia.org/wiki/N._T._Rama_Rao_Jr.,,"Nandamuri Taraka Rama Rao (born 20 May 1983), also known as NTR and Tarak, is an Indian film actor and television personality known for his works in Telugu cinema.  He is the grandson of Telugu actor N. T. Rama Rao, who was the Chief Minister of Andhra Pradesh and who was commonly referred to as ""NTR"". In 1996, he starred as a child artist in Ramayanam, which won the National Film Award for Best Children's Film for that year. His debut as an adult was in 2000 with the film Ninnu Choodalani. In his film career spanning 18 years, Rao has worked in 28 films. He has received two state Nandi Awards, two Filmfare Best Telugu Actor Awards and four CineMAA Awards."
Om Puri,https://en.wikipedia.org/wiki/Om_Puri,https://upload.wikimedia.org/wikipedia/commons/thumb/e/ee/OmPuriSept10TIFF.jpg/220px-OmPuriSept10TIFF.jpg,"Om Prakash Puri, OBE (18 October 1950 – 6 January 2017) was an Indian actor who appeared in mainstream commercial Hindi films, as well as independent and art films. He is best known for his author-backed roles in films like Aakrosh (1980), Arohan (1982), Ardh Satya and television films like Sadgati (1981) and Tamas (1987) and also light-hearted roles in Jaane Bhi Do Yaaro (1983) and Chachi 420 (1997). He had various collaborations with director Shyam Benegal and Govind Nihalani. Puri also appeared in non-Indian productions in the United States and Britain."
Ninad Kamat,https://en.wikipedia.org/wiki/Ninad_Kamat,https://upload.wikimedia.org/wikipedia/commons/thumb/3/31/Ninad_Kamat.jpg/220px-Ninad_Kamat.jpg,"Ninad Kamat is an Indian Bollywood film actor. Some of his movies are Zabardast, Kabhi Up Kabhi Down, Shiva, Lage Raho Munnabhai, 7½ Phere, Viruddh, Dus, Parineeta, Zeher, Sangharsh, Doli Sajake Rakhna and Jai Gangaajal. He has also worked as a playback singer in Shiva and Darna Mana Hai. He is one of India's foremost voicing talents, having given his voice to thousands of commercials. He has dubbed for Amitabh Bachchan, Sachin Tendulkar, Will Smith, Jim Carrey and more."
Nikhil Kumar (actor),https://en.wikipedia.org/wiki/Nikhil_Gowda,,Nikhil Kumarswamy is an Indian actor and Politician. He has acted in the Kannada and Telugu film industries. He made his acting debut with the Kannada-Telugu bilingual film Jaguar (2016).
Negro Johnny,https://en.wikipedia.org/wiki/Negro_Johnny,https://upload.wikimedia.org/wikipedia/en/2/2a/Negro-Johnny-pic.jpg,"Johnny known professionally as Negro Johnny was an Indian film actor & stunt co-ordinator in the Kannada film industry, as well as Malayalam, Telugu, Tamil film industries. Some of the notable films of Negro Johnny as an actor include Samyuktha (1988), Gajapathi Garvabhanga (1989) and SP Sangliyana 2 (1990)."
Nilu Phule,https://en.wikipedia.org/wiki/Nilu_Phule,https://upload.wikimedia.org/wikipedia/commons/thumb/0/01/Nilu_Phule.jpg/220px-Nilu_Phule.jpg,Nilu Phule (died 13 July 2009) was an Indian actor known for his roles in the Marathi language movies and Marathi theatre. Nilu Phule acted in around 250 Marathi and Hindi movies during his film career. He is widely regarded as one of the greatest and iconic actors to have graced the Marathi Cinema. He was most prominently seen playing the roles of notorious villains in the movies.
Nikhil Siddharth,https://en.wikipedia.org/wiki/Nikhil_Siddharth,,"Nikhil Siddhartha (born 1 June) is an actor in the Telugu film industry. After playing minor roles in few films, Nikhil rose to fame with Sekhar Kammula's college drama Happy Days (2007). He went on to star in several critically and commercially acclaimed films such as Yuvatha (2008), Alasyam Amrutham (2010), Veedu Theda (2011) Swamy Ra Ra (2013), Karthikeya (2014), Surya vs Surya (2015), Ekkadiki Pothavu Chinnavada (2016), Keshava (2017), Kirrak Party (2018) and Arjun Suravaram (2019)."
Neil Nitin Mukesh,https://en.wikipedia.org/wiki/Neil_Nitin_Mukesh,https://upload.wikimedia.org/wikipedia/commons/thumb/5/59/Neil_Nitin_Mukesh_at_the_Volkswagen_event.jpg/220px-Neil_Nitin_Mukesh_at_the_Volkswagen_event.jpg,"Neil Nitin Mukesh (born 15 January 1982) is an Indian actor, who appears in Hindi-language films. He is the son, and grandson of singers Nitin Mukesh and Mukesh, respectively."
Nawazuddin Siddiqui,https://en.wikipedia.org/wiki/Nawazuddin_Siddiqui,https://upload.wikimedia.org/wikipedia/commons/thumb/c/ca/Nawazuddin_Siddiqui_-_IIFA_2017_Green_Carpet_%2836349709816%29_%28cropped%29.jpg/220px-Nawazuddin_Siddiqui_-_IIFA_2017_Green_Carpet_%2836349709816%29_%28cropped%29.jpg,"Nawazuddin Siddiqui (born 19 May 1974) is an Indian actor, known for his works in Hindi cinema. An alumnus of the National School of Drama. Nawazuddin Siddiqui started getting roles in independent films; these were the films which gave him and Indian Cinema recognition internationally. Most of his Independent films have received critical acclaim at International Films Festivals, such as the Academy Awards, Cannes Film Festival, Berlin Film Festival, Busan Film Festival, Tribeca Film Festival, and the Asia Pacific Screen Awards."
Narendra Prasad,https://en.wikipedia.org/wiki/Narendra_Prasad,https://upload.wikimedia.org/wikipedia/en/thumb/d/d3/Narendra_Prasad.jpg/220px-Narendra_Prasad.jpg,"Raghava Kurup Narendra Prasad (26 December 1946 – 3 November 2003) was a popular Indian actor, playwright, director, teacher and literary critic. He was born at Mavelikara, Alappuzha District, in the south Indian state of Kerala."
Nassar (actor),https://en.wikipedia.org/wiki/Nassar_(actor),https://upload.wikimedia.org/wikipedia/commons/thumb/c/c8/Nassar_at_Oru_Kadhai_Sollattumaa_Audio_Launch.jpg/220px-Nassar_at_Oru_Kadhai_Sollattumaa_Audio_Launch.jpg,"M. Nassar (born 5 March 1958) is a polyglot Indian film actor, director, producer, dubbing artist and playback singer who mainly works in the South Indian film industry. He is the incumbent leader of the Nadigar Sangam."
Nedumudi Venu,https://en.wikipedia.org/wiki/Nedumudi_Venu,https://upload.wikimedia.org/wikipedia/commons/thumb/9/9b/Nedumudi_Venu_2008.jpg/220px-Nedumudi_Venu_2008.jpg,"Kesavan Venugopal (born 22 May 1948), known popularly by his stage name Nedumudi Venu, is an Indian film actor from Kerala, who predominantly works in the Malayalam Cinema. Widely regarded as one of the greatest actors in Indian cinema of all time, he has acted in more than 500 films, primarily in Malayalam and also in Tamil. He has also written screenplays and has directed one film. He has won two National Film Awards and six Kerala State Film Awards for his various performances."
N. T. Rama Rao,https://en.wikipedia.org/wiki/N._T._Rama_Rao,https://upload.wikimedia.org/wikipedia/commons/thumb/a/a9/N._T._Rama_Rao_in_Shavukaru_%281950%29.jpg/220px-N._T._Rama_Rao_in_Shavukaru_%281950%29.jpg,"Nandamuri Taraka Rama Rao (28 May 1923 – 18 January 1996), popularly known as NTR, was a great Indian actor, producer, director, film editor and politician who served as Chief Minister of Andhra Pradesh for seven years over three terms. He is widely regarded as one of the greatest actors of Indian cinema and one of the two legends of Telugu cinema, along with Akkineni Nageswara Rao. NTR received three National Film Awards for co-producing Thodu Dongalu (1954) and Seetharama Kalyanam (1960) under National Art Theater, Madras, and for directing Varakatnam (1970). NTR has received the erstwhile Rashtrapati Awards for his performance(s) in the Raju Peda (1954) and the Lava Kusa (1963). He garnered the Nandi Award for Best Actor for Kodalu Diddina Kapuram in 1970, and the Inaugural Filmfare Award for Best Actor – Telugu in 1972 for Badi Panthulu.He is also titled as “Viswa Vikhyatha Nata Sarvabhouma”."
Navdeep,https://en.wikipedia.org/wiki/Navdeep,,Navdeep Pallapolu is an Indian film actor and television personality who stars predominantly in Telugu films along with a few Tamil films.
Naresh (actor),https://en.wikipedia.org/wiki/Naresh_(actor),https://upload.wikimedia.org/wikipedia/commons/thumb/7/7e/Naresh-Vijaya-Krishna.jpg/220px-Naresh-Vijaya-Krishna.jpg,"Naresh Vijaya Krishna, popularly known as Naresh, is an Indian film actor, politician and social activist known for his works predominantly in Telugu cinema and television. He began acting as child in 1970, and starred in around 200 films in a variety of roles including lead actor, father and comedy roles. Some of the box office successes he appeared in were Rendu Jella Sita (1983), Sreevariki Prema Lekha (1984), Sri Kanaka Mahalaxmi Recording Dance Troupe (1987), Bava Bava Panneeru (1989), Manasu Mamatha (1990) and Jamba Lakidi Pamba (1993). He also received the title H.E. (his Excellency) and received a PHD in arts (his 2nd doctorate) from the United Nations ICDRHRP group."
Narasimha Raju (Telugu actor),https://en.wikipedia.org/wiki/Narasimharaju_(Telugu_actor),,"Narasimha Raju or Narasimharaju is a Telugu and Tamil film and television actor. He was known as Andhra Kamal Haasan. He rose to the heights of stardom with his movies, Needaleni Adadi, Turpu Padamara, Kanyakumari, Idekkadi Nyayam and Jaganmohini. He was considered the folk hero of the generation next to that of N. T. Rama Rao and Tadepalli Lakshmi Kanta Rao."
Narain (actor),https://en.wikipedia.org/wiki/Narain_(actor),https://upload.wikimedia.org/wikipedia/commons/thumb/b/b1/Narain_Actor.jpg/220px-Narain_Actor.jpg,"Sunil Kumar, known by his stage name Narain, is an Indian film actor, who has starred in Malayalam, Tamil and Telugu films. He made his debut in Adoor Gopalakrishnan's Nizhalkuthu (2002), followed by performances in Malayalam films 4 the People (2004), Achuvinte Amma (2005), and Classmates (2006). Narain's Tamil debut was in Mysskin's Chithiram Pesuthadi (2006)."
Narasimharaju (Kannada actor),https://en.wikipedia.org/wiki/Narasimharaju_(Kannada_actor),https://upload.wikimedia.org/wikipedia/en/d/d2/Narasimharaju_%28Kannada_actor%29.jpg,Tiptur Ramaraju Narasimharaju (Kannada: ನರಸಿಂಹರಾಜು) (24 July 1923 – 11 July 1979) was a very popular Kannada actor specialised in roles that required ample comic timing. He was the comedy stalwart of the Kannada film industry. He acted in more than 250 Kannada films between 1954 and 1979. He was also referred to as Hasya Chakravarti.
Namit Shah,https://en.wikipedia.org/wiki/Namit_Shah_(actor),,"Shah started his career with an HSBC commercial in 2009, which was not aired in India. Since then, he starred in many television commercials. He was also featured in a Reebok advertisement alongside former India national cricket team captain, Mahendra Singh Dhoni. He has done various small roles for soap operas."
Nagineedu,https://en.wikipedia.org/wiki/Nagineedu,,V. Nagineedu (Telugu: నాగినీడు) is an actor in the South Indian Film Industry who is active in Telugu and Tamil films. He won Nandi Award for Best Villain for his role in Maryada Ramanna. He played a similar role in G. S. Karthik's 2013 film Adda.
Nani (actor),https://en.wikipedia.org/wiki/Nani_(actor),https://upload.wikimedia.org/wikipedia/commons/thumb/0/01/Nani_at_Aaha_Kalyanam_audio_launch_%28cropped%29.jpg/220px-Nani_at_Aaha_Kalyanam_audio_launch_%28cropped%29.jpg,"Nani (born as Naveen Babu Ghanta on 24 February 1984) is an Indian film actor, film producer, media personality, and television presenter primarily known for his work in Telugu cinema, but has also done a few Tamil films. He was an assistant director and worked with Srinu Vaitla and Bapu, before working as an RJ for World Space Satellite in Hyderabad."
Nandish Sandhu,https://en.wikipedia.org/wiki/Nandish_Sandhu,https://upload.wikimedia.org/wikipedia/commons/thumb/1/1b/Nandish_at_awards.JPG/220px-Nandish_at_awards.JPG,"Nandish Sandhu (born 25 December 1981) is a model and television actor. He started his career with modeling, and debuted as a television actor on the series Kasturi, where he played Raunak."
Nana Patekar,https://en.wikipedia.org/wiki/Nana_Patekar,,"Nana Patekar (born 1 January 1951) is an Indian film actor and writer, philanthropist and filmmaker, mainly working in Hindi and Marathi cinema."
Konidela Nagendra Babu,https://en.wikipedia.org/wiki/Nagendra_Babu,https://upload.wikimedia.org/wikipedia/commons/thumb/7/7a/Kanche-Movie-Audio-Launch-15.jpg/220px-Kanche-Movie-Audio-Launch-15.jpg,Konidela Nagendra Babu is an Indian actor and producer associated with the Telugu film industry.
Akkineni Nageswara Rao,https://en.wikipedia.org/wiki/Akkineni_Nageswara_Rao,https://upload.wikimedia.org/wikipedia/commons/thumb/4/45/ANR_wiki.jpg/220px-ANR_wiki.jpg,"Akkineni Nageswara Rao (20 September 1924 – 22 January 2014), widely known as ANR, was an Indian film actor and producer, known for his work predominantly in Telugu cinema. He starred in many landmark films in his seventy five-year career, becoming one of the most prominent figures in the history of Indian cinema. He is considered one of the greatest and most successful actors of Indian cinema and one of the two pillars of Telugu Cinema, along with N.T.Rama Rao. He was one of the instrumental figures in moving the Telugu cinema industry from Madras to Hyderabad in the early 1960s. He established Annapurna Studios in 1975 to provide infrastructural support to the Telugu film industry in Hyderabad. He later started the Annapurna International School of Film and Media within Annapurna Studios in 2011."
Nagendra Prasad,https://en.wikipedia.org/wiki/Nagendra_Prasad,https://upload.wikimedia.org/wikipedia/commons/thumb/a/a6/India_film_clapperboard_%28variant%29.svg/30px-India_film_clapperboard_%28variant%29.svg.png,"Nagendra Prasad is an Indian dance choreographer and actor. He is the youngest son of dance master Mugur Sundar, and younger brother to popular cine artistes Prabhu Deva and Raju Sundaram. He was most noted for his appearance in the song ""Humma Humma"", from the film Bombay. He has also acted in the 2001 super hit Kannada movie Chithra, opposite Rekha Vedavyas a.k.a. Akshara. He also acted in the Kannada movie Manasalla Neene, which was directed by his father – ace choreographer Mugur Sundaram and was the remake of the super hit Telugu movie Manasantha Nuvve, starring Uday Kiran and Reema Sen. He has also acted in a tele-serial called ""Maya Machindra"" on STAR Vijay. He took part in Jodi number 1 season 7. He was eliminated in the semi-finals, but his performance in all the rounds were outstanding. He has a dance school, MSM dance school named after his father."
Navin Prabhakar,https://en.wikipedia.org/wiki/Navin_Prabhakar,,"Navin Prabhakar is an Indian comedian, singer, actor and a mimicry artist. He is most known for his Pehchan Kaun (Mumbai bar girl) act on The Great Indian Laughter Challenge (2005). Subsequently, he hosted a mimicry and stand-up show Hello Kaun? Pehchaan Kaun (2008–2009)."
