Name,Wiki URL,Image URL,Description
Pooja Umashankar,https://en.wikipedia.org/wiki/Pooja_Umashankar,https://upload.wikimedia.org/wikipedia/commons/thumb/1/18/Pooja_Gauthami_Umashankar.JPG/220px-Pooja_Gauthami_Umashankar.JPG,"Pooja Gauthami Umashankar, mononymously known as Pooja, is an Indian-Sri Lankan film actress, who has appeared in Tamil films as well as Sinhalese, Malayalam and amateur films. Following a series of successful commercial ventures, Bala's Naan Kadavul saw Pooja's performance as a blind beggar praised by the critics, securing major awards, including the South Filmfare, Hiru golden Film awards ( Most popular actress ) and Tamil Nadu State Film Awards. She simultaneously worked in Sinhalese cinema and was part of several successful films like Anjalika (2006), Asai Man Piyabanna (2007), Suwanda Denuna Jeewithe (2010) and Kusa Pabha (2012), thus establishing herself as one of the leading actresses of Sinhalese cinema."
Poonam Bajwa,https://en.wikipedia.org/wiki/Poonam_Bajwa,https://upload.wikimedia.org/wikipedia/commons/thumb/c/cd/PoonamBajwa2019.jpg/220px-PoonamBajwa2019.jpg,"Poonam Bajwa (5 April 1985) is an Indian film actress and model who appears in Malayalam, Telugu, Tamil and Kannada films. She made her acting debut in 2005 with the Telugu film Modati Cinema, after that she was featured in more Telugu film, such as Boss (2006). Her debut Tamil movie was Seval (2008). She exposed her talent by her acting in various movies in different languages."
Pooja Lokesh,https://en.wikipedia.org/wiki/Pooja_Lokesh,,Pooja Lokesh is an Indian film actress in the Kannada and Tamil film industry.
Pooja Kanwal,https://en.wikipedia.org/wiki/Pooja_Kanwal,https://upload.wikimedia.org/wikipedia/commons/thumb/2/29/Pooja_kanwal_1.jpg/220px-Pooja_kanwal_1.jpg,Pooja Kanwal is an Indian actress. She appeared in Palampur Express where she portrayed the lead role of Pawni.
Pramila Joshai,https://en.wikipedia.org/wiki/Pramila_Joshai,https://upload.wikimedia.org/wikipedia/commons/thumb/a/a6/India_film_clapperboard_%28variant%29.svg/30px-India_film_clapperboard_%28variant%29.svg.png,"Pramila Joshai is an Indian film actress in the Kannada film industry. Some of the films of Pramila Joshai as an actor include Saheba (2017), Thayi (2008), Apthamitra (2004). She was credited as Parimalam in her debut Tamil film Vaidehi Kathirunthal (1984) which became a blockbuster hit and has attained cult status over the years."
Piaa Bajpai,https://en.wikipedia.org/wiki/Pia_Bajpai,https://upload.wikimedia.org/wikipedia/commons/thumb/c/c0/Piaa_Bajpai_%28cropped%29.jpg/220px-Piaa_Bajpai_%28cropped%29.jpg,"Pia Bajpiee is an Indian film actress and model, who appears in Tamil, Telugu, Malayalam, Hindi and English. She is best known for her performances as Roshini in Venkat Prabhu's comedy Goa and Saro in K. V. Anand's political thriller Ko Leadrole. Before acting in films, she had been a model in commercials."
Pooja Batra,https://en.wikipedia.org/wiki/Pooja_Batra,https://upload.wikimedia.org/wikipedia/commons/7/7b/Pooja_Batra.jpg,Pooja Batra is an Indian actress and model. She was crowned Femina Miss India International in 1993.
Payal Ghosh,https://en.wikipedia.org/wiki/Payal_Ghosh,https://upload.wikimedia.org/wikipedia/commons/thumb/d/d3/Payal_Ghosh_graces_the_Topgear_awards.jpg/220px-Payal_Ghosh_graces_the_Topgear_awards.jpg,Payal Ghosh (born 13 November 1989) is an Indian celebrity actress who has recently made her debut into Bollywood.
Perizaad Zorabian,https://en.wikipedia.org/wiki/Perizaad_Zorabian,https://upload.wikimedia.org/wikipedia/commons/thumb/f/f0/Perizaad_zorbian_still.jpg/220px-Perizaad_zorbian_still.jpg,Perizaad Zorabian is an Indian actress. Her film debut was with Nagesh Kukunoor's Bollywood Calling and she gained international recognition for her role as Jenny in Subhash Ghai's Joggers' Park (2003).
Payal Rohatgi,https://en.wikipedia.org/wiki/Payal_Rohatgi,https://upload.wikimedia.org/wikipedia/commons/thumb/2/2d/Payal_rohatgi_colors_indian_telly_awards.jpg/220px-Payal_rohatgi_colors_indian_telly_awards.jpg,Payal Rohatgi (born 9 November 1984) is an Indian actress and reality TV performer who appears in Bollywood films. She was a contestant in the reality show Bigg Boss in 2008. She has made controversial remarks on social media on multiple occasions.
Patralekha Paul,https://en.wikipedia.org/wiki/Patralekha,https://upload.wikimedia.org/wikipedia/commons/thumb/4/4e/Patralekha_snapped_attending_the_Lakme_Fashion_Week_2018.jpg/220px-Patralekha_snapped_attending_the_Lakme_Fashion_Week_2018.jpg,"Patralekha Mishra Paul (born 20 February 1990) is an Indian film actress. Her father, a chartered accountant, wanted her to follow in his footsteps, but she was interested in acting. She made her debut with director Hansal Mehta's Hindi film CityLights, alongside Rajkummar Rao."
Parvathi Menon,https://en.wikipedia.org/wiki/Parvati_Menon,,"Parvathi  is a Malayalam film actress and dubbing artist. She played Lady Tarkov, a Russian gangster, in the movie Double Barrel which was directed by Lijo Jose Pellissery and Salim Ahamed's Pathemari."
Pooja Bhatt,https://en.wikipedia.org/wiki/Pooja_Bhatt,https://upload.wikimedia.org/wikipedia/commons/a/a4/Pooja_Bhatt_grace_the_press_meet_of_the_film_Cabaret_at_JW_Marriott_Juhu_%282%29_%28cropped%29.jpg,"Pooja Bhatt (born 24 February 1972) is an Indian film director, actress, voice over artist, model and film maker. The recipient of several accolades, including two National Film Awards."
Patience Cooper,https://en.wikipedia.org/wiki/Patience_Cooper,https://upload.wikimedia.org/wikipedia/commons/thumb/1/12/Patience_Cooper.jpg/250px-Patience_Cooper.jpg,"Patience Cooper (1905–1993) was an India born Pakistani film actress. An Anglo-Indian from Calcutta, Cooper had a successful career in both silent and sound films. She was one of the early superstars of Bollywood. Cooper is credited with the first double roles of Indian cinema—as twin sisters in Patni Pratap and as mother and daughter in Kashmiri Sundari, even though earlier in 1917, actor Anna Salunke had played roles of both the male lead character Ram and the female lead character Seeta in the film Lanka Dahan."
Payel Sarkar,https://en.wikipedia.org/wiki/Payel_Sarkar,,"Payel Sarkar
(born 10 February 1984 in Kolkata, India) is an Indian actress who has appeared in Bengali films and Hindi television."
Pooja Bedi,https://en.wikipedia.org/wiki/Pooja_Bedi,https://upload.wikimedia.org/wikipedia/commons/thumb/3/33/Pooja_Bedi_grace_the_launch_of_Farah_Khan_Ali%E2%80%99s_book_%27A_Bejewelled_Life%27.jpg/180px-Pooja_Bedi_grace_the_launch_of_Farah_Khan_Ali%E2%80%99s_book_%27A_Bejewelled_Life%27.jpg,"Pooja Bedi (born 11 May 1970) is a former Bollywood actress, television talk show host and newspaper columnist. She is the daughter of actor Kabir Bedi and the late Protima Bedi. Pooja participated in the popular reality show, Bigg Boss in 2011."
Parveen Babi,https://en.wikipedia.org/wiki/Parveen_Babi,https://upload.wikimedia.org/wikipedia/en/thumb/7/72/Parveen_Babi.jpg/220px-Parveen_Babi.jpg,"Parveen Babi (4 April 1949 – 20 January 2005) was an Indian film actress, model, and an interior designer. She is most remembered for her appearances in several commercially-successful films, and playing mostly bold roles throughout the 1970s and early 1980s. Regarded as one of the most glamorous actresses throughout Hindi cinema, she was also one of the highest paid actresses of her time."
Parul Gulati,https://en.wikipedia.org/wiki/Parul_Gulati,https://upload.wikimedia.org/wikipedia/commons/thumb/8/89/ParulGulati.jpg/220px-ParulGulati.jpg,"Parul Gulati (born 6 August, 1994) is an Indian actress who has appeared in several Punjabi films. She is a trained actor who has studied at Royal Academy of Dramatic Art (RADA), London."
Parvathi (Actress),https://en.wikipedia.org/wiki/Parvathy_Jayaram,https://upload.wikimedia.org/wikipedia/commons/thumb/6/63/Parvathi_actress.jpg/220px-Parvathi_actress.jpg,"Ashwathy Kurup, better known by her stage name Parvathy, is an Indian film actress and classical dancer, who appeared in Malayalam films."
Parvathy Omanakuttan,https://en.wikipedia.org/wiki/Parvathy_Omanakuttan,https://upload.wikimedia.org/wikipedia/commons/thumb/8/8e/Parvathy_Omanakuttan_at_SNDT_Chrysalis_2012_fashion_show_%283%29.jpg/220px-Parvathy_Omanakuttan_at_SNDT_Chrysalis_2012_fashion_show_%283%29.jpg,"Parvathy Omanakuttan (born 13 March 1987) is an Indian actress, model and beauty pageant titleholder who was crowned Miss India 2008 and later became first runner-up at Miss World 2008. She was also awarded the titles of Miss World Asia & Oceania at the Miss World 2008 competition."
Parminder Nagra,https://en.wikipedia.org/wiki/Parminder_Nagra,https://upload.wikimedia.org/wikipedia/commons/thumb/6/6e/Parminder_Nagra_by_Gage_Skidmore_2.jpg/220px-Parminder_Nagra_by_Gage_Skidmore_2.jpg,"Parminder Kaur Nagra (born 5 October 1975) is an English film and television actress. She is known for playing Jess Bhamra in the film Bend It Like Beckham (2002), and as Dr. Neela Rasgotra in the NBC medical drama series ER from 2003 to 2009. She has had several other major television roles, including a starring role as Meera Malik in the NBC crime drama series The Blacklist for season one and a recurring role on the ABC/Marvel Television series Agents of S.H.I.E.L.D. as Ellen Nadeer for season four."
Parvati Melton,https://en.wikipedia.org/wiki/Parvati_Melton,https://upload.wikimedia.org/wikipedia/commons/thumb/9/9a/Parvathi_Melton.jpg/220px-Parvathi_Melton.jpg,"Parvathi Melton (born January 7, 1988) is an American actress and former model of partial Indian descent. She mainly works in the Telugu film industry. She appeared in several Telugu and Malayalam movies. She acted with Raja in the film Vennela, which turned out to be a success. She acted in the super hit Malayalam film Hallo with Mohanlal. She again shot to fame with item song ""Poovai Poovai"" in Telugu movie Dookudu opposite Mahesh Babu."
Parul Chauhan,https://en.wikipedia.org/wiki/Parul_Chauhan,https://upload.wikimedia.org/wikipedia/commons/thumb/f/f7/Ragini_aka_parul.jpg/220px-Ragini_aka_parul.jpg,"Parul Chauhan Thakkar is an Indian television actress popular for her portrayal as Ragini Sharma in Sapna Babul Ka...Bidaai and Swarna Chopra in Yeh Rishta Kya Kehlata Hai. Before venturing into acting, she did modelling. In 2009, she participated as a contestant in the reality series Jhalak Dikhhla Jaa 3."
Pakhi Tyrewala,https://en.wikipedia.org/wiki/Pakhi_Tyrewala,https://upload.wikimedia.org/wikipedia/commons/thumb/2/21/Paakhi_A_Tyrewala.jpg/220px-Paakhi_A_Tyrewala.jpg,"Paakhi A Tyrewala (born 6 June 1984) is the stage name of Punarnava Mehta an Indian writer-cum-director, who debuted in mainstream Bollywood in 2002 with the film Yeh Kya Ho Raha Hai?, in which she is credited with real name Punarnava Mehta. She later changed her name to Paakhi, which is her nickname, and adopted Tyrewala after her marriage to Abbas Tyrewala. She was relaunched by her husband Abbas in 2010 with her new name ""Paakhi"" in the film Jhootha Hi Sahi."
Parvati Nair,https://en.wikipedia.org/wiki/Parvathy_Nair,https://upload.wikimedia.org/wikipedia/commons/thumb/c/c6/Parvatii_Nair.jpg/220px-Parvatii_Nair.jpg,"Parvati Nair (born Parvathy Venugopal Nair) is an Indian model and actress who works in the South Indian film industry. Born into a Malayali family in Abu Dhabi, she trained as a software professional while pursuing a career in modelling, before becoming an actress. . During her modelling career, she appeared in a number of commercials and won the titles ""Miss Karnataka"" and ""Miss Navy Queen""."
Panchi Bora,https://en.wikipedia.org/wiki/Panchi_Bora,https://upload.wikimedia.org/wikipedia/commons/thumb/7/7a/Photo_Of_Panchi_Bora_From_The_3rd_Boroplus_Gold_Awards_2010.jpg/220px-Photo_Of_Panchi_Bora_From_The_3rd_Boroplus_Gold_Awards_2010.jpg,"Panchi Bora is an Indian television actress and model from Assam. She plays lead roles in the series Kayamath and Kitni Mast Hai Zindagi, before working in the Telugu film industry."
Paoli Dam,https://en.wikipedia.org/wiki/Paoli_Dam,https://upload.wikimedia.org/wikipedia/commons/thumb/e/ea/Paoli_Dam_saree_image.jpg/220px-Paoli_Dam_saree_image.jpg,"Paoli Dam (born 4 October 1980) is an Indian actress who started her career with the Bengali television serial Jibon Niye Khela (2003). She then worked in Bengali television serials such as Tithir Atithi and Sonar Harin; the former ran for six years on ETV Bangla.
Dam spent her childhood in Kolkata, earning a postgraduate degree in chemistry from Rajabazar Science College. Initially, she wanted to become a chemical researcher or a pilot.
Her debut Bengali film—Teen Yaari Katha, directed by Sudeshna Roy and Abhijit Guha—began in 2004, but was not released until 2012. Dam's first film release was Agnipariksha, directed by Rabi Kinagi. Between 2006 and 2009, she appeared in five Bengali films, coming into prominence with the 2009 Kaalbela, directed by Goutam Ghose."
Parineeti Chopra,https://en.wikipedia.org/wiki/Parineeti_Chopra,https://upload.wikimedia.org/wikipedia/commons/thumb/8/8c/Parineeti-Chopra-grace-the-HT-Style-Awards-2018-19.jpg/220px-Parineeti-Chopra-grace-the-HT-Style-Awards-2018-19.jpg,"Parineeti Chopra (pronounced ; born 22 October 1988) is an Indian actress and singer who appears in Hindi films. Chopra is a recipient of several accolades, including a Filmfare and National Film Award. She initially aspired to pursue a career in investment banking, but after obtaining a triple honours degree in business, finance and economics from Manchester Business School she returned to India during the 2009 economic recession and joined Yash Raj Films as a public relations consultant."
Pandari Bai,https://en.wikipedia.org/wiki/Pandari_Bai,https://upload.wikimedia.org/wikipedia/en/thumb/8/8d/Pandari_Bai.jpg/220px-Pandari_Bai.jpg,"Pandari Bai (8 September 1928 – 29 January 2003) was a prominent actress of South Indian languages films, mostly in Kannada language during the 1950s, 1960s and 1970s. She is considered Kannada cinema's first successful heroine. She has acted as both heroine and mother to stalwarts such as Rajkumar, MGR and Sivaji Ganesan. She was the heroine in Rajkumar's debut movie Bedara Kannappa and also Sivaji's debut movie Parasakthi. She has acted in over 1,000 films in Kannada, Tamil, Telugu and Hindi. in 1991, she was honoured by a Kalaimamani from the Tamil Nadu government.citation needed]"
Parul Yadav,https://en.wikipedia.org/wiki/Parul_Yadav,https://upload.wikimedia.org/wikipedia/commons/thumb/1/1f/Parul_Yadav.jpg/220px-Parul_Yadav.jpg,"Parul Yadav  is an Indian film actress and producer, who has appeared in South Indian films, primarily in Kannada along with a few Malayalam and Tamil films. She made her acting debut with Tamil film Dreams, starring Dhanush and Diya. With the four upcoming south remakes of the Bollywood film ""Queen"", Parul is debuting as the Co-Producer for all the four films and also has acted in the Kannada Version Butterfly."
Pallavi Joshi,https://en.wikipedia.org/wiki/Pallavi_Joshi,https://upload.wikimedia.org/wikipedia/commons/thumb/3/3d/Pallavi_Joshi.png/220px-Pallavi_Joshi.png,Pallavi Joshi (born 4 April 1969) is an Indian film and television actress. She is a recipient of Special Jury Award at the National Film Awards.
Pallavi Subhash,https://en.wikipedia.org/wiki/Pallavi_Subhash,,"Pallavi Subhash Shirke (born 9 June 1984) is an Indian film and television actress. A Maharashtrian model turned actress, she has started her career with Marathi plays, films and TV shows, then appeared in Hindi TV shows. She's the only Marathi actress who has worked in not only all south Indian languages like Telugu, Tamil, Malayalam and Kannada, but in Sri Lankan language too. Pallavi won a Golden Petal Award in 2016 as Dharma in Chakravartin Ashoka Samrat."
Pallavi Kulkarni,https://en.wikipedia.org/wiki/Pallavi_Kulkarni,https://upload.wikimedia.org/wikipedia/commons/thumb/5/5c/Pallavi_Kulkarni_au_S%C3%A9n%C3%A9gal.jpg/220px-Pallavi_Kulkarni_au_S%C3%A9n%C3%A9gal.jpg,Pallavi Kulkarni is an Indian television actress.
Pooja Gandhi,https://en.wikipedia.org/wiki/Pooja_Gandhi,https://upload.wikimedia.org/wikipedia/commons/thumb/c/cb/Puja_during_Karimedu_film_promotion.jpg/220px-Puja_during_Karimedu_film_promotion.jpg,"Pooja Gandhi (born Sanjana Gandhi in 1983) is an Indian actress and producer, who mainly works in Kannada language films and also appears in Tamil, Malayalam, Bengali and Hindi. Gandhi after starring in the commercially successful 2006 film Mungaru Male, become one of the most popular and highest paid actresses in South Indian cinema and also the recipient of several awards. Gandhi popularly came to be known as 'Male Hudugi' (Rain Girl) in the media and Kannada film industry."
Pallavi Sharda,https://en.wikipedia.org/wiki/Pallavi_Sharda,https://upload.wikimedia.org/wikipedia/commons/thumb/9/99/Pallavi_Sharda_%28cropped%29.jpg/220px-Pallavi_Sharda_%28cropped%29.jpg,"Pallavi Sharda (born 5 March 1990) is an Australian-Indian film actress. She has worked in Hindi films like My Name Is Khan, Dus Tola, Besharam , Hawaizaada and Begum Jaan."
Padmini Kolhapure,https://en.wikipedia.org/wiki/Padmini_Kolhapure,https://upload.wikimedia.org/wikipedia/commons/thumb/7/76/PadminiKolhapure.jpg/220px-PadminiKolhapure.jpg,"Padmini Kolhapure (born 1 November 1965) is an Indian actress and singer, who works primarily in Hindi films. She began acting in 1972 at the age of 7, and her early works included Zindagi (1976) and Dream Girl (1977). She then made her official film debut with the film Satyam Shivam Sundaram (1978), starring as Young Roopa. Kolhapure then became one of the most prominent actresses throughout the 1980s."
Padma Vasanthi,https://en.wikipedia.org/wiki/Padma_Vasanthi,https://upload.wikimedia.org/wikipedia/commons/thumb/a/a6/India_film_clapperboard_%28variant%29.svg/30px-India_film_clapperboard_%28variant%29.svg.png,"Padma Vasanthi  is an Indian film actress in the Kannada film industry. Some of the films of Padma Vasanthi as an actress include Maanasa Sarovara (1982) Bettada Hoovu (1985), Mussanje Mathu (2008)."
Padma Kumta,https://en.wikipedia.org/wiki/Padma_Kumta,https://upload.wikimedia.org/wikipedia/en/4/4a/Padma-Kumta-pic.jpg,"Padma Kumta or Padma Kumata was an Indian film actress in the Kannada film industry. Some of the notable films of Padma Kumta as an actress include Chomana Dudi (1975), Bayalu Daari (1976), Phalitamsha (1976), Avasthe (1987) and Arivu (2017). She died of cardiac arrest."
Padmini (actress),https://en.wikipedia.org/wiki/Padmini_(actress),https://upload.wikimedia.org/wikipedia/commons/thumb/e/ec/Padmini_Ramachandran.jpg/220px-Padmini_Ramachandran.jpg,"Padmini  (12 June 1932 – 24 September 2006) was an Indian Actress and trained Bharathanatyam dancer, who acted in over 250 Indian films. She acted in Tamil, Hindi, Malayalam Telugu and Russian language films. She was a popular actress of her time.  Padmini, with her elder sister Lalitha and her younger sister Ragini, were called the ""Travancore sisters""."
Padmapriya (actress),https://en.wikipedia.org/wiki/Padmapriya,https://upload.wikimedia.org/wikipedia/en/thumb/3/3f/Padmapriya-actress-pic.jpg/220px-Padmapriya-actress-pic.jpg,Padmapriya (born Padmalochani) was predominantly a Kannada and Tamil actress who also acted in a few Malayalam and Telugu movies.
Nutan,https://en.wikipedia.org/wiki/Nutan,https://upload.wikimedia.org/wikipedia/commons/thumb/c/c9/Baarish_Nutan_%28cropped%29.jpg/220px-Baarish_Nutan_%28cropped%29.jpg,"Nutan Samarth (born; 4 June 1936 – 21 February 1991), better known as Nutan, was an Indian film actress. In a career spanning nearly four decades, she appeared in more than 70 Hindi films, many in starring roles. Regarded as one of the finest female actors in the history of Indian cinema, Nutan was noted for playing unconventional parts and her performances often received praise and accolades. Nutan holds the record of five wins of the Best Actress award at Filmfare, which was held only by her for over 30 years until it was matched by her niece Kajol in 2011. In 1974, she was awarded the Padma Shri by the Government of India."
Nimrat Kaur,https://en.wikipedia.org/wiki/Nimrat_Kaur,https://upload.wikimedia.org/wikipedia/commons/thumb/6/6c/Nimrat_Kaur_snapped_attending_the_Lakme_Fashion_Week_2018_%2811%29.jpg/220px-Nimrat_Kaur_snapped_attending_the_Lakme_Fashion_Week_2018_%2811%29.jpg,"Nimrat Kaur (born 13 March 1982) is an Indian actress. She began her career as a print model and went on to act in theater. After brief appearances in a few films, Kaur starred in Anurag Kashyap's production Peddlers, which was screened at the 2012 Cannes Film Festival. She followed it with her breakthrough role in The Lunchbox, a critically acclaimed drama co-starring Irrfan Khan, which was screened at the 2013 Cannes Film Festival."
Padma Lakshmi,https://en.wikipedia.org/wiki/Padma_Lakshmi,https://upload.wikimedia.org/wikipedia/commons/thumb/1/13/Padma_Lakshmi_at_the_2008_Tribeca_Film_Festival.JPG/220px-Padma_Lakshmi_at_the_2008_Tribeca_Film_Festival.JPG,"Padma Parvati Lakshmi Vaidynathan (born September 1, 1970), known professionally as Padma Lakshmi (pronounced ), is an American author, actress, model, and television host. She is the host of the US cooking competition program Top Chef."
Padmaja Rao,https://en.wikipedia.org/wiki/Padmaja_Rao,,"Padmaja Rao is an Indian film actress, TV serial Director and Producer in Karnataka, India.  She is a versatile actor known for playing a wide variety of character roles in various film genres. Some of the notable films of Padmaja Rao as an actress include  Hatavadi (2006) Mungaru Male (2006), Gaalipata (2008), Ugramm (2006). She has also forayed into tulu film industry with the blockbuster Chaali Polilu (2014)"
Nivedita Jain,https://en.wikipedia.org/wiki/Nivedita_Jain,https://upload.wikimedia.org/wikipedia/en/5/54/NiveditaJainImage.jpg,"Nivedita Jain (9 June 1979 – 10 June 1998) was a beauty contestant and an actress who appeared in Kannada films. She was crowned Miss Bangalore in 1994. She made her debut as actress in the 1996 released film, Shivaranjini."
Nithya Menen,https://en.wikipedia.org/wiki/Nithya_Menen,,"Nithya Menen (born 8 April 1988) is an Indian film actress and playback singer who appears in Malayalam, Tamil, Kannada, Telugu and Hindi films where she has established herself as a leading actress. She is recipient of three Filmfare Awards for the Telugu films Gunde Jaari Gallanthayyinde, Malli Malli Idi Rani Roju and Mersal in Tamil."
Nora Fatehi,https://en.wikipedia.org/wiki/Nora_Fatehi,https://upload.wikimedia.org/wikipedia/commons/thumb/8/8a/Nora_Fatehi_at_the_trailer_launch_of_Batla_House.jpg/220px-Nora_Fatehi_at_the_trailer_launch_of_Batla_House.jpg,"Nora Fatehi (born 6 February 1992) is a Canadian dancer, model, actress and singer who has mainly appeared in Hindi films. She has also starred in Malayalam and Telugu films. She comes from a Moroccan Canadian family, and was born and raised in Canada, although in interviews despite being of Moroccan descent she has stated that she considers herself ""an Indian at heart"". She is most known for her work in the  Indian film industry. She made her film debut in the Bollywood film Roar: Tigers of the Sundarbans. She gained popularity in Telugu cinema by doing item numbers in films like Temper, Beginning|Baahubali]] and Kick 2 and has also starred in two Malayalam films, Double Barrel and Kayamkulam Kochunni."
Nivedita Joshi-Saraf,https://en.wikipedia.org/wiki/Nivedita_Joshi_Saraf,https://upload.wikimedia.org/wikipedia/commons/thumb/6/69/NiveditaJoshi.jpg/220px-NiveditaJoshi.jpg,"Nivedita Saraf is an Indian actress who worked in Marathi and Hindi film industry of the late 1980s and early 1990s. She is married to Marathi and Hindi films actor Ashok Saraf. Since July 2019, she is playing a lead role in the Marathi-language serial Aagabai Sasubai on Zee Marathi."
Nithya Das,https://en.wikipedia.org/wiki/Nithya_Das,,Nithya Das is an Indian film actress best known for her Malayalam films. She was active in the industry during the early-2000s.
Padma Khanna,https://en.wikipedia.org/wiki/Padma_Khanna,https://upload.wikimedia.org/wikipedia/commons/thumb/1/1c/Wiki_letter_w_cropped.svg/20px-Wiki_letter_w_cropped.svg.png,"Padma Khanna (born 10 March 1949) is an Indian actress, dancer and director. She appeared mainly in Hindi and Bhojpuri films in the 1970s and 1980s. She is most remembered for her role in the film Saudagar with Amitabh Bachchan and also as Queen Kaikeyi in Ramanand Sagar's epic series Ramayan (1987–1988). She has acted in two Telugu films with N. T. Rama Rao Desoddarakulu and Rajaputra Rahasyam."
Noor Jehan,https://en.wikipedia.org/wiki/Noor_Jehan,https://upload.wikimedia.org/wikipedia/commons/thumb/7/71/Noor_Jehan_in_Zeenat.jpg/220px-Noor_Jehan_in_Zeenat.jpg,"Noor Jehan, also spelled Noorjehan, 
(Urdu: نُورجہاں ‎), (born Allah Wasai; 23 September 1926 – 23 December 2000), also known by her honorific title Malika-e-Tarannum (Urdu: ملِکہ ترنّم ‎), the queen of melody), was a Pakistani playback singer and actress who worked first in British India and then in Pakistan. Her career spanned more than six decades (1930s–1990s). She was renowned as one of the greatest and most influential singers of all time especially throughout South Asia and was given the honorific title of Malika-e-Tarannum in Pakistan. She had a command of Hindustani classical music as well as other music genres."
